{
  "schema_version": 1,
  "id": "2026-10-12",
  "span": {
    "start": "2026-10-12",
    "end": "2026-10-18"
  },
  "created_at": "2026-10-11T18:00:00Z",
  "style": "loose",
  "targets": {
    "kcal": 2400,
    "kcal_source": "reading 2026-10-11",
    "protein_floor_g": 110
  },
  "input": {
    "exceptions": [
      {
        "date": "2026-10-14",
        "slot": "dinner",
        "entry": {
          "cover": "out",
          "kcal": 1100,
          "protein_g": 45
        },
        "note": "birthday"
      },
      {
        "date": "2026-10-18",
        "slot": "lunch",
        "entry": {
          "cover": "roast at a friend's",
          "kcal": 800,
          "protein_g": 45
        }
      }
    ],
    "assignments": [
      {
        "date": "2026-10-12",
        "slot": "lunch",
        "entry": {
          "recipe": "turkey-chilli"
        }
      },
      {
        "date": "2026-10-13",
        "slot": "lunch",
        "entry": {
          "recipe": "chicken-rice-bowl",
          "variations": [
            "light"
          ],
          "lock": "post-run, must be quick"
        }
      },
      {
        "date": "2026-10-14",
        "slot": "lunch",
        "entry": {
          "recipe": "turkey-chilli"
        }
      },
      {
        "date": "2026-10-15",
        "slot": "lunch",
        "entry": {
          "recipe": "chicken-rice-bowl",
          "variations": [
            "light"
          ]
        }
      },
      {
        "date": "2026-10-16",
        "slot": "lunch",
        "entry": {
          "recipe": "turkey-chilli"
        }
      },
      {
        "date": "2026-10-17",
        "slot": "lunch",
        "entry": {
          "recipe": "turkey-chilli"
        }
      },
      {
        "date": "2026-10-16",
        "slot": "dinner",
        "entry": {
          "recipe": "spinach-omelette"
        }
      },
      {
        "date": "2026-10-17",
        "slot": "dinner",
        "entry": {
          "recipe": "spinach-omelette"
        }
      },
      {
        "date": "2026-10-18",
        "slot": "dinner",
        "entry": {
          "recipe": "spinach-omelette"
        }
      }
    ],
    "use_up": [
      {
        "item": "spinach",
        "qty": 100,
        "unit": "g"
      }
    ],
    "notes": "Batch the chilli on Sunday."
  },
  "days": [
    {
      "date": "2026-10-12",
      "office": false,
      "items": [
        {
          "slot": "breakfast",
          "source": "template",
          "recipe": "overnight-oats",
          "title": "Overnight oats",
          "variations": [],
          "covered_by": null,
          "cover": null,
          "name": null,
          "skip": false,
          "lock": null,
          "note": null,
          "kcal": 440,
          "protein_g": 30
        },
        {
          "slot": "lunch",
          "source": "assignment",
          "recipe": "turkey-chilli",
          "title": "Turkey chilli",
          "variations": [],
          "covered_by": null,
          "cover": null,
          "name": null,
          "skip": false,
          "lock": null,
          "note": null,
          "kcal": 620,
          "protein_g": 48
        },
        {
          "slot": "dinner",
          "source": "template",
          "recipe": null,
          "title": null,
          "variations": [],
          "covered_by": null,
          "cover": "family",
          "name": null,
          "skip": false,
          "lock": null,
          "note": null,
          "kcal": 900,
          "protein_g": 40
        },
        {
          "slot": "snack",
          "source": "anchor",
          "recipe": null,
          "title": null,
          "variations": [],
          "covered_by": null,
          "cover": null,
          "name": "Whey shake",
          "skip": false,
          "lock": null,
          "note": null,
          "kcal": 150,
          "protein_g": 30
        }
      ],
      "totals": {
        "kcal": 2110,
        "protein_g": 148
      }
    },
    {
      "date": "2026-10-13",
      "office": true,
      "items": [
        {
          "slot": "breakfast",
          "source": "template",
          "recipe": "overnight-oats",
          "title": "Overnight oats",
          "variations": [],
          "covered_by": null,
          "cover": null,
          "name": null,
          "skip": false,
          "lock": null,
          "note": null,
          "kcal": 440,
          "protein_g": 30
        },
        {
          "slot": "lunch",
          "source": "assignment",
          "recipe": "chicken-rice-bowl",
          "title": "Chicken + rice bowl",
          "variations": [
            "light"
          ],
          "covered_by": null,
          "cover": null,
          "name": null,
          "skip": false,
          "lock": "post-run, must be quick",
          "note": null,
          "kcal": 505,
          "protein_g": 50
        },
        {
          "slot": "dinner",
          "source": "template",
          "recipe": null,
          "title": null,
          "variations": [],
          "covered_by": null,
          "cover": "family",
          "name": null,
          "skip": false,
          "lock": null,
          "note": null,
          "kcal": 900,
          "protein_g": 40
        },
        {
          "slot": "snack",
          "source": "anchor",
          "recipe": null,
          "title": null,
          "variations": [],
          "covered_by": null,
          "cover": null,
          "name": "Whey shake",
          "skip": false,
          "lock": null,
          "note": null,
          "kcal": 150,
          "protein_g": 30
        }
      ],
      "totals": {
        "kcal": 1995,
        "protein_g": 150
      }
    },
    {
      "date": "2026-10-14",
      "office": false,
      "items": [
        {
          "slot": "breakfast",
          "source": "template",
          "recipe": "overnight-oats",
          "title": "Overnight oats",
          "variations": [],
          "covered_by": null,
          "cover": null,
          "name": null,
          "skip": false,
          "lock": null,
          "note": null,
          "kcal": 440,
          "protein_g": 30
        },
        {
          "slot": "lunch",
          "source": "assignment",
          "recipe": "turkey-chilli",
          "title": "Turkey chilli",
          "variations": [],
          "covered_by": null,
          "cover": null,
          "name": null,
          "skip": false,
          "lock": null,
          "note": null,
          "kcal": 620,
          "protein_g": 48
        },
        {
          "slot": "dinner",
          "source": "exception",
          "recipe": null,
          "title": null,
          "variations": [],
          "covered_by": null,
          "cover": "out",
          "name": null,
          "skip": false,
          "lock": null,
          "note": "birthday",
          "kcal": 1100,
          "protein_g": 45
        },
        {
          "slot": "snack",
          "source": "anchor",
          "recipe": null,
          "title": null,
          "variations": [],
          "covered_by": null,
          "cover": null,
          "name": "Whey shake",
          "skip": false,
          "lock": null,
          "note": null,
          "kcal": 150,
          "protein_g": 30
        }
      ],
      "totals": {
        "kcal": 2310,
        "protein_g": 153
      }
    },
    {
      "date": "2026-10-15",
      "office": true,
      "items": [
        {
          "slot": "breakfast",
          "source": "template",
          "recipe": "overnight-oats",
          "title": "Overnight oats",
          "variations": [],
          "covered_by": null,
          "cover": null,
          "name": null,
          "skip": false,
          "lock": null,
          "note": null,
          "kcal": 440,
          "protein_g": 30
        },
        {
          "slot": "lunch",
          "source": "assignment",
          "recipe": "chicken-rice-bowl",
          "title": "Chicken + rice bowl",
          "variations": [
            "light"
          ],
          "covered_by": null,
          "cover": null,
          "name": null,
          "skip": false,
          "lock": null,
          "note": null,
          "kcal": 505,
          "protein_g": 50
        },
        {
          "slot": "dinner",
          "source": "template",
          "recipe": null,
          "title": null,
          "variations": [],
          "covered_by": null,
          "cover": "family",
          "name": null,
          "skip": false,
          "lock": null,
          "note": null,
          "kcal": 900,
          "protein_g": 40
        },
        {
          "slot": "snack",
          "source": "anchor",
          "recipe": null,
          "title": null,
          "variations": [],
          "covered_by": null,
          "cover": null,
          "name": "Whey shake",
          "skip": false,
          "lock": null,
          "note": null,
          "kcal": 150,
          "protein_g": 30
        }
      ],
      "totals": {
        "kcal": 1995,
        "protein_g": 150
      }
    },
    {
      "date": "2026-10-16",
      "office": false,
      "items": [
        {
          "slot": "breakfast",
          "source": "template",
          "recipe": "overnight-oats",
          "title": "Overnight oats",
          "variations": [],
          "covered_by": null,
          "cover": null,
          "name": null,
          "skip": false,
          "lock": null,
          "note": null,
          "kcal": 440,
          "protein_g": 30
        },
        {
          "slot": "lunch",
          "source": "assignment",
          "recipe": "turkey-chilli",
          "title": "Turkey chilli",
          "variations": [],
          "covered_by": null,
          "cover": null,
          "name": null,
          "skip": false,
          "lock": null,
          "note": null,
          "kcal": 620,
          "protein_g": 48
        },
        {
          "slot": "dinner",